{
  "version": 1,
  "updated": "2026-10-29",
  "categories": [
    {
      "id": "portrait",
      "label": {
        "zh": "人像",
        "en": "Portraits"
      }
    },
    {
      "id": "product",
      "label": {
        "zh": "产品摄影",
        "en": "Product shots"
      }
    },
    {
      "id": "infographic",
      "label": {
        "zh": "信息图",
        "en": "Infographics"
      }
    },
    {
      "id": "figurine",
      "label": {
        "zh": "3D / 手办",
        "en": "3D and figurines"
      }
    },
    {
      "id": "style-transfer",
      "label": {
        "zh": "风格迁移",
        "en": "Style transfer"
      }
    },
    {
      "id": "editing",
      "label": {
        "zh": "图像编辑",
        "en": "Image editing"
      }
    },
    {
      "id": "video",
      "label": {
        "zh": "视频",
        "en": "Video"
      }
    },
    {
      "id": "typography",
      "label": {
        "zh": "文字排版",
        "en": "Typography"
      }
    },
    {
      "id": "logo",
      "label": {
        "zh": "标志",
        "en": "Logos"
      }
    },
    {
      "id": "fashion",
      "label": {
        "zh": "时尚",
        "en": "Fashion"
      }
    },
    {
      "id": "comic",
      "label": {
        "zh": "连环画",
        "en": "Comics"
      }
    },
    {
      "id": "ui",
      "label": {
        "zh": "界面",
        "en": "UI"
      }
    },
    {
      "id": "illustration",
      "label": {
        "zh": "插画",
        "en": "Illustration"
      }
    },
    {
      "id": "education",
      "label": {
        "zh": "教学图解",
        "en": "Education"
      }
    },
    {
      "id": "advertising",
      "label": {
        "zh": "广告",
        "en": "Advertising"
      }
    },
    {
      "id": "photography",
      "label": {
        "zh": "摄影",
        "en": "Photography"
      }
    }
  ],
  "models": [
    {
      "id": "nano-banana-2",
      "label": {
        "zh": "Nano Banana 2",
        "en": "Nano Banana 2"
      }
    },
    {
      "id": "nano-banana-pro",
      "label": {
        "zh": "Nano Banana Pro",
        "en": "Nano Banana Pro"
      }
    },
    {
      "id": "nano-banana-2.1",
      "label": {
        "zh": "Nano Banana 2.1",
        "en": "Nano Banana 2.1"
      }
    },
    {
      "id": "gpt-image-2",
      "label": {
        "zh": "GPT Image 2",
        "en": "GPT Image 2"
      }
    },
    {
      "id": "sora-2",
      "label": {
        "zh": "Sora 2",
        "en": "Sora 2"
      }
    }
  ],
  "legacy_collections": [
    {
      "id": "nano-banana",
      "title": {
        "zh": "Nano Banana 精选图集",
        "en": "Nano Banana gallery"
      },
      "href": "../text-to-image/nano-banana/awesome-nano-banana-images/",
      "href_en": "../text-to-image/nano-banana/awesome-nano-banana-images/",
      "model": "nano-banana",
      "note": {
        "zh": "既有 Markdown 合集，未迁移正文。",
        "en": "Existing Markdown collection, left in place."
      }
    },
    {
      "id": "nano-banana-pro",
      "title": {
        "zh": "Nano Banana Pro 精选图集",
        "en": "Nano Banana Pro gallery"
      },
      "href": "../text-to-image/nano-banana/awesome-nano-banana-pro-images/",
      "href_en": "../text-to-image/nano-banana/awesome-nano-banana-pro-images/",
      "model": "nano-banana-pro",
      "note": {
        "zh": "既有 Markdown 合集，未迁移正文。",
        "en": "Existing Markdown collection, left in place."
      }
    },
    {
      "id": "gpt-4o",
      "title": {
        "zh": "GPT-4o 精选图集",
        "en": "GPT-4o gallery"
      },
      "href": "../text-to-image/gpt/awesome-gpt4o-images/",
      "href_en": "../text-to-image/gpt/awesome-gpt4o-images/",
      "model": "gpt-4o",
      "note": {
        "zh": "既有 Markdown 合集，未迁移正文。",
        "en": "Existing Markdown collection, left in place."
      }
    },
    {
      "id": "gpt-image-1",
      "title": {
        "zh": "gpt-image-1 精选案例",
        "en": "gpt-image-1 cases"
      },
      "href": "../text-to-image/gpt/gpt-image-1/",
      "href_en": "../text-to-image/gpt/gpt-image-1/",
      "model": "gpt-image-1",
      "note": {
        "zh": "既有 Markdown 合集，未迁移正文。",
        "en": "Existing Markdown collection, left in place."
      }
    },
    {
      "id": "sora-2-archive",
      "title": {
        "zh": "Sora 2 提示词大全",
        "en": "Sora 2 prompt archive"
      },
      "href": "../text-to-video/awesome-sora2/",
      "href_en": "../text-to-video/awesome-sora2/",
      "model": "sora-2",
      "note": {
        "zh": "既有 Markdown 合集，未迁移正文。",
        "en": "Existing Markdown collection, left in place."
      }
    },
    {
      "id": "hunyuan",
      "title": {
        "zh": "混元图像 3.0 案例",
        "en": "Hunyuan Image 3.0 cases"
      },
      "href": "../text-to-image/hunyuan-image-3-0/",
      "href_en": "../text-to-image/hunyuan-image-3-0/",
      "model": "hunyuan-image-3",
      "note": {
        "zh": "既有 Markdown 合集，未迁移正文。",
        "en": "Existing Markdown collection, left in place."
      }
    }
  ],
  "cases": [
    {
      "id": "nb2-magazine-cover",
      "title": {
        "en": "Glossy magazine cover",
        "zh": "杂志封面文字"
      },
      "description": {
        "en": "Official Nano Banana 2 example of a store-shelf magazine with exact cover lines and a portrait.",
        "zh": "Nano Banana 2 官方示例：货架上的杂志封面，封面文字和人像同时出现。"
      },
      "tips": {
        "en": "Put exact words in quotes, name the typeface, and say where the issue number, date, and barcode sit.",
        "zh": "把必须出现的文字放进引号，写明字体，并指定期号、日期和条码的位置。"
      },
      "category": "typography",
      "tags": [
        "text-rendering",
        "editorial",
        "product"
      ],
      "model": "nano-banana-2",
      "modality": "text-to-image",
      "requires_reference": false,
      "prompt": "A photo of a glossy magazine cover, the minimal blue cover has the large bold words Nano Banana. The text is in a serif font and fills the view. No other text. In front of the text there is a portrait of a person in a sleek and minimal dress. She is playfully holding the number 2, which is the focal point. Put the issue number and \"Feb 2026\" date in the corner along with a barcode. The magazine is on a shelf against an orange plastered wall, within a designer store.",
      "prompt_language": "en",
      "prompt_translations": {
        "zh": "一张光面杂志封面的照片。极简的蓝色封面上有巨大的粗体文字 “Nano Banana”。文字使用衬线字体，并占满画面。不要其他文字。文字前方是一位身穿利落极简连衣裙的人像，她俏皮地举着数字 2，这是视觉焦点。把期号和日期 “Feb 2026” 放在角落，并配上条码。杂志放在设计师商店里、一面橙色抹灰墙前的货架上。"
      },
      "images": [
        {
          "role": "output",
          "src": "/images/cases/nb2-magazine-cover-output.webp",
          "alt": {
            "en": "Magazine cover result",
            "zh": "杂志封面结果"
          },
          "width": 960,
          "height": 644
        }
      ],
      "source": {
        "author": "Google",
        "author_url": "https://ai.google.dev/",
        "title": "Nano Banana image generation",
        "url": "https://ai.google.dev/gemini-api/docs/image-generation",
        "section": "Generated by Nano Banana 2 — magazine cover",
        "license": "CC BY 4.0",
        "license_url": "https://creativecommons.org/licenses/by/4.0/",
        "changes": "Resized and re-encoded as WebP (longest edge 960px) for page weight. Prompt text is unchanged.",
        "retrieved": "2026-10-14"
      }
    },
    {
      "id": "nbpro-london-isometric",
      "title": {
        "en": "Isometric London weather miniature",
        "zh": "伦敦等距天气微缩"
      },
      "description": {
        "en": "Official Nano Banana Pro example: a 45-degree miniature of London with weather, date, and temperature text.",
        "zh": "Nano Banana Pro 官方示例：45 度俯视的伦敦微缩场景，带天气、日期和温度文字。"
      },
      "tips": {
        "en": "Specify the camera angle, materials, what real-world data to integrate, and the exact text hierarchy.",
        "zh": "写明机位角度、材质、要融入的真实信息，以及标题、图标、日期、温度的字号层级。"
      },
      "category": "figurine",
      "tags": [
        "3d",
        "infographic",
        "search-grounding",
        "text-rendering"
      ],
      "model": "nano-banana-pro",
      "modality": "text-to-image",
      "requires_reference": false,
      "prompt": "Present a clear, 45° top-down isometric miniature 3D cartoon scene of London, featuring its most iconic landmarks and architectural elements. Use soft, refined textures with realistic PBR materials and gentle, lifelike lighting and shadows. Integrate the current weather conditions directly into the city environment to create an immersive atmospheric mood. Use a clean, minimalistic composition with a soft, solid-colored background. At the top-center, place the title \"London\" in large bold text, a prominent weather icon beneath it, then the date (small text) and temperature (medium text). All text must be centered with consistent spacing, and may subtly overlap the tops of the buildings.",
      "prompt_language": "en",
      "prompt_translations": {
        "zh": "呈现一个清晰的、45 度俯视等距微缩 3D 卡通伦敦场景，包含最有代表性的地标和建筑元素。使用柔和精致的纹理、写实的 PBR 材质，以及自然的光照和阴影。把当前天气直接融入城市环境，形成沉浸的氛围。构图干净极简，背景是柔和的纯色。顶部居中放置大号粗体标题 “London”，其下是醒目的天气图标，然后是小号日期和中号温度。所有文字居中、间距一致，可以轻微压住建筑顶部。"
      },
      "images": [
        {
          "role": "output",
          "src": "/images/cases/nbpro-london-isometric-output.webp",
          "alt": {
            "en": "Isometric London result",
            "zh": "伦敦等距结果"
          },
          "width": 960,
          "height": 960
        }
      ],
      "source": {
        "author": "Google",
        "author_url": "https://ai.google.dev/",
        "title": "Nano Banana image generation",
        "url": "https://ai.google.dev/gemini-api/docs/image-generation",
        "section": "Generated by Nano Banana Pro — London isometric",
        "license": "CC BY 4.0",
        "license_url": "https://creativecommons.org/licenses/by/4.0/",
        "changes": "Resized and re-encoded as WebP (longest edge 960px) for page weight. Prompt text is unchanged.",
        "retrieved": "2026-10-14"
      }
    },
    {